Keyword,Repository Name,Owner,Description,URL
fairness toolkit,BasicTS,zezhishao,A Standard and  Fair Time Series Forecasting Benchmark and Toolkit.,https://github.com/zezhishao/BasicTS
fairness toolkit,Fairness.jl,ashryaagr,Julia Toolkit with fairness metrics and bias mitigation algorithms,https://github.com/ashryaagr/Fairness.jl
fairness toolkit,cotk,thu-coai,Conversational Toolkit. An Open-Source Toolkit for Fast Development and Fair Evaluation of Text Generation,https://github.com/thu-coai/cotk
fairness toolkit,LiFT,linkedin,The LinkedIn Fairness Toolkit (LiFT) is a Scala/Spark library that enables the measurement of fairness in large scale machine learning workflows.,https://github.com/linkedin/LiFT
fairness toolkit,responsibly,ResponsiblyAI,Toolkit for Auditing and Mitigating Bias and Fairness of Machine Learning Systems 🔎🤖🧰,https://github.com/ResponsiblyAI/responsibly
fairness toolkit,veritastool,mas-veritas2,Veritas Diagnosis Toolkit for Fairness Assessment,https://github.com/mas-veritas2/veritastool
fairness toolkit,EthicML,wearepal,"Package for evaluating the performance of methods which aim to increase fairness, accountability and/or transparency",https://github.com/wearepal/EthicML
tensorflow fairness,fairness-indicators,tensorflow,Tensorflow's Fairness Evaluation and Visualization Toolkit,https://github.com/tensorflow/fairness-indicators
tensorflow fairness,InferSent,HsiaoYetGun,TensorFlow implementation of FAIR's InferSent (Supervised Learning of Universal Sentence Representations from Natural Language Inference Data),https://github.com/HsiaoYetGun/InferSent
tensorflow fairness,make-a-video,soran-ghaderi,"""Make-A-Video"", new SOTA text to video by Meta-FAIR - Tensorflow",https://github.com/soran-ghaderi/make-a-video
tensorflow fairness,fairness-tensorflow-toxicity-classification,sharmi1206,Tensorflow constrained optimization with different Deep Learning Models ,https://github.com/sharmi1206/fairness-tensorflow-toxicity-classification
tensorflow fairness,Data-Domain-Fairness,wearepal,,https://github.com/wearepal/Data-Domain-Fairness
tensorflow fairness,Vitaminator-core,LordDarkula,Synopsys Science Fair Project 2016,https://github.com/LordDarkula/Vitaminator-core
tensorflow fairness,recog-tensorflow,ByteOfKathy,Science fair 2019 redone using tensorflow,https://github.com/ByteOfKathy/recog-tensorflow
tensorflow fairness,Model_Fairness_And_Transperancy,manjum2050,This project integrate the google WhatIfTool (WIT) on TensorFlow Keras Neuranl Net Models,https://github.com/manjum2050/Model_Fairness_And_Transperancy
tensorflow fairness,fairness-india-hiring,sharmi1206,fairness constraint with Tensorflow Constrained Optimization in the context of InDian jobs ,https://github.com/sharmi1206/fairness-india-hiring
tensorflow fairness,panoculus-tensorflow,lakhaninaail,Files from 2019-2020 science fair project: PanOculus,https://github.com/lakhaninaail/panoculus-tensorflow
ibm fairness,ensure-loan-fairness-aif360,IBM,"A demonstration of the AI Fairness 360 toolbox for bias metrics, explanations, and remediation.  Code Pattern: https://developer.ibm.com/patterns/ensuring-fairness-when-processing-loan-applications",https://github.com/IBM/ensure-loan-fairness-aif360
ibm fairness,IBM-CFC,an-hai-tran,"This is the code repository for Vaccine Fairness & Equity, a project dedicated to the IBM Call for Code Fair Work Case Competition",https://github.com/an-hai-tran/IBM-CFC
ibm fairness,MLFairnessPipeline,markbentivegna,IBM Fairness Project,https://github.com/markbentivegna/MLFairnessPipeline
ibm fairness,ibm_fairness,timkok,,https://github.com/timkok/ibm_fairness
ibm fairness,IBM-Fairness-Pipeline,srishtikarakoti,,https://github.com/srishtikarakoti/IBM-Fairness-Pipeline
ibm fairness,IBM-AI-FAIRNESS-TOOLKIT,Sami-ullah-AI,,https://github.com/Sami-ullah-AI/IBM-AI-FAIRNESS-TOOLKIT
ibm fairness,CS634_IBM_Fairness_Pipeline,rtikyani,Detecting and mitigating age bias on credit decisions¶,https://github.com/rtikyani/CS634_IBM_Fairness_Pipeline
ibm fairness,IBMi,JeremyMoore1973,IBM i Code for Scholastic Book Fairs,https://github.com/JeremyMoore1973/IBMi
ibm fairness,fairness-in-ML,pernillej,"Exploration of fairness in Machine Learning, using IBM AI Fairness 360 (AIF360) tool.",https://github.com/pernillej/fairness-in-ML
ibm fairness,lab_aif360,Thorfin49,Presentation and labs for IBM AI Fairness 360,https://github.com/Thorfin49/lab_aif360
microsoft fairness,Microsoft_Fairness,chamusyuan1996,,https://github.com/chamusyuan1996/Microsoft_Fairness
microsoft fairness,Installation01,Joseph3D,Installation 01 is an open source Halo FPS game being developed by longtime fans of the franchise. We are in full compliance with Microsoft's Fair Use policy.,https://github.com/Joseph3D/Installation01
microsoft fairness,rai-fairness,teepipe,Fairness test and model update with fairlearn annd microsoft RAI,https://github.com/teepipe/rai-fairness
microsoft fairness,TEALS-Workshop-DS-ML-2018,ANovaBerkeley,Data Science and Machine Learning workshop for the Microsoft TEALS CS Fair 2018 (designed for beginners),https://github.com/ANovaBerkeley/TEALS-Workshop-DS-ML-2018
microsoft fairness,Khoj-Feedback-Form,rahulbdominic,Feedback form for school science fair. Built on Microsoft Azure.,https://github.com/rahulbdominic/Khoj-Feedback-Form
microsoft fairness,MedicalFileTransfer2,Michael-Viscardi,My Project for the Microsoft 2019 TEALS fair.,https://github.com/Michael-Viscardi/MedicalFileTransfer2
microsoft fairness,MedicalFileTransfer2Doctor,Michael-Viscardi,My project for the 2019 Microsoft TEALS fair.,https://github.com/Michael-Viscardi/MedicalFileTransfer2Doctor
microsoft fairness,dotNet,Queue-Fair,"The Queue-Fair Virtual Waiting Room for .NET, ASP and C# (Microsoft) Webservers. For more, see https://queue-fair.com/how-traffic-can-crash-your-website and for more information about virtual waiting room software see https://queue-fair.com/difference-between-virtual-waiting-room-and-virtual-queue-management",https://github.com/Queue-Fair/dotNet
microsoft fairness,My-Experience-With-Chatbots,FumzyLala,"I have had my fair share of chatbot 'headaches', navigating from 'Google- Dialog -Flow' to 'Microsoft-Bot-Framework'",https://github.com/FumzyLala/My-Experience-With-Chatbots
microsoft fairness,fartip.com,johnnypeck,FARTIP - Helping myself assimilate Microsoft's 6 Principles of Responsible Artificial Intelligence,https://github.com/johnnypeck/fartip.com
import aequitas,Quaff,RobertBuchananAk,Import LMS data into Queue Gradebook,https://github.com/RobertBuchananAk/Quaff
aequitas,aequitas,dssg,Bias and Fairness Audit Toolkit ,https://github.com/dssg/aequitas
aequitas,aequitas,emmanuel,A Validations library. Someday.,https://github.com/emmanuel/aequitas
aequitas,Aequitas,sakshiudeshi,"Aequitas, a directed fairness testing framework machine learning models.",https://github.com/sakshiudeshi/Aequitas
aequitas,aequitas,g-andrade,Fairness regulator and rate limiter,https://github.com/g-andrade/aequitas
aequitas,Aequitas,SymbioticLab,Aequitas enables RPC-level QoS in datacenter networks.,https://github.com/SymbioticLab/Aequitas
aequitas,aequitas-lib,aequitas-aod,Aequitas library,https://github.com/aequitas-aod/aequitas-lib
aequitas,master,TeamAequitas,OOP Project - Team Aequitas,https://github.com/TeamAequitas/master
aequitas,Aequitas-Neural-Search,CyrusYang-cy,Neural Search for the Aequitas project,https://github.com/CyrusYang-cy/Aequitas-Neural-Search
aequitas,udacity-aequitas-exercise,nikohunt,Quick tutorial on the major features of Aequitas,https://github.com/nikohunt/udacity-aequitas-exercise
aequitas,prototype-api,aequitas-aod,Context Service prototype supporting the aequitas-lib,https://github.com/aequitas-aod/prototype-api
themis-ml,themis-ml,cosmicBboy,A library that implements fairness-aware machine learning algorithms,https://github.com/cosmicBboy/themis-ml
themis-ml,Themis-ML,ls1intum,Themis-ML - automated feedback on programing exercises,https://github.com/ls1intum/Themis-ML
themis-ml,themis-ml,RichardRossJr,,https://github.com/RichardRossJr/themis-ml
themis-ml,Themis-ML,rishabparasharGA,Themis project codebase,https://github.com/rishabparasharGA/Themis-ML
themis-ml,Criminal-Recividism-Analysis,preranap1,Criminal Recidivism Risk Analysis for Parole Decisions using Themis ML Package,https://github.com/preranap1/Criminal-Recividism-Analysis
themis-ml,621-Evaluation-of-Discrimination-Measurements-using-Themis-ml-,ZixinKong,"Extended and used “themis-ml”, an existing open-source fairness-aware machine learning Python library",https://github.com/ZixinKong/621-Evaluation-of-Discrimination-Measurements-using-Themis-ml-
themis-ml,Machine-Bias-Mitigation,juliaYi,Detect machine bias on House Mortgage Data and develop three fairness aware models using Themis-ML package in Python,https://github.com/juliaYi/Machine-Bias-Mitigation
themis-ml,debias-in-machine-learning,Yuexi-Li,Mitigate machine learning bias to ensure data ethics in U.S. national home mortgage dataset.,https://github.com/Yuexi-Li/debias-in-machine-learning
drivendataorg/deon,deon,drivendataorg,A command line tool to easily add an ethics checklist to your data science projects.,https://github.com/drivendataorg/deon
fairkit-learn,fairkit-learn,INSPIRED-GMU,,https://github.com/INSPIRED-GMU/fairkit-learn
fat-forensics,dfir_ntfs,msuhanov,An NTFS/FAT parser for digital forensics & incident response,https://github.com/msuhanov/dfir_ntfs
fat-forensics,fatcat,Gregwar,"FAT filesystems explore, extract, repair, and forensic tool",https://github.com/Gregwar/fatcat
fat-forensics,fat-forensics,fat-forensics,"Modular Python Toolbox for Fairness, Accountability and Transparency Forensics",https://github.com/fat-forensics/fat-forensics
fat-forensics,fat-forensics-circle,alexhepburn,,https://github.com/alexhepburn/fat-forensics-circle
fat-forensics,fat-forensics-doc,fat-forensics,FAT Forensics Documentation,https://github.com/fat-forensics/fat-forensics-doc
fat-forensics,events,fat-forensics,Upcoming and past events run with the FAT Forensics package,https://github.com/fat-forensics/events
fat-forensics,resources,fat-forensics,Miscellaneous FAT Forensics resources,https://github.com/fat-forensics/resources
fat-forensics,fatf-dashboard,fat-forensics,An example dashboard for FAT Forensics,https://github.com/fat-forensics/fatf-dashboard
fat-forensics,forensics-fat32-utils,bluebears-dev,,https://github.com/bluebears-dev/forensics-fat32-utils
fat-forensics,fat16forensics,DeepnathG,,https://github.com/DeepnathG/fat16forensics
fairness_indicators,fairness-indicators,tensorflow,Tensorflow's Fairness Evaluation and Visualization Toolkit,https://github.com/tensorflow/fairness-indicators
